{
  "definition": {
    "quality_rubric": {
      "criteria": [
        {
          "accepted_equivalents": "Any accurate wording supported by frozen source or protected behavior.",
          "dimension": "correctness",
          "id": "substance",
          "requirement": "onResult precedes no-match and ignore decisions; ignored matches call onIgnore, never onMatch; accepted matches call onMatch.",
          "semantic": true
        },
        {
          "dimension": "completeness",
          "id": "requested-coverage",
          "requirement": "Trace matcher, ignore and callbacks for a match, an ignored match and a nonmatching path. Give executable observations of event order. Write your answer to BENCHMARK_ANSWER.md and stop.",
          "semantic": true
        },
        {
          "dimension": "evidence",
          "id": "grounding",
          "requirement": "Bind factual claims to actual source ranges or reproducible checks; distinguish static inference from verified behavior.",
          "semantic": true
        },
        {
          "dimension": "usability",
          "id": "usability",
          "requirement": "Give actionable, internally consistent output at the detail the task requests.",
          "semantic": true
        },
        {
          "dimension": "causality",
          "id": "causal-chain",
          "requirement": "Explain or implement the causal relationship, including requested negative controls.",
          "semantic": true
        }
      ],
      "task_id": "panel-t1",
      "version": 1
    }
  },
  "oracle_id": "panel-t1",
  "schema_version": "1.0",
  "task_id": "panel-t1",
  "visibility": "public"
}
