{
  "definition": {
    "quality_rubric": {
      "criteria": [
        {
          "accepted_equivalents": "Any accurate wording supported by frozen source or protected behavior.",
          "dimension": "correctness",
          "id": "substance",
          "requirement": "consumer.display consumes runtime format; type-consumer.defaults consumes Options only; wrapper.convert propagates runtime options; unrelated.format is a negative control.",
          "semantic": true
        },
        {
          "dimension": "completeness",
          "id": "requested-coverage",
          "requirement": "Assess changing the exported default for format. Enumerate runtime and type consumers, wrapper behavior and negative controls. Write your answer to BENCHMARK_ANSWER.md and stop.",
          "semantic": true
        },
        {
          "dimension": "evidence",
          "id": "grounding",
          "requirement": "Bind factual claims to actual source ranges or reproducible checks; distinguish static inference from verified behavior.",
          "semantic": true
        },
        {
          "dimension": "usability",
          "id": "usability",
          "requirement": "Give actionable, internally consistent output at the detail the task requests.",
          "semantic": true
        }
      ],
      "task_id": "panel-i3",
      "version": 1
    }
  },
  "oracle_id": "panel-i3",
  "schema_version": "1.0",
  "task_id": "panel-i3",
  "visibility": "public"
}
