{
  "definition": {
    "quality_rubric": {
      "criteria": [
        {
          "accepted_equivalents": "Any accurate wording supported by frozen source or protected behavior.",
          "dimension": "correctness",
          "id": "substance",
          "requirement": "The parser passes search_profile through ContextRequest; active_similarity_search_profile selects the configured profile and rejects unknown values; CLI overrides task selection, profile configuration uses effective precedence.",
          "semantic": true
        },
        {
          "dimension": "completeness",
          "id": "requested-coverage",
          "requirement": "Trace context --search-profile from argument parsing through configuration, query execution and backend selection. Explain configuration precedence and errors for an unknown profile. Write your answer to BENCHMARK_ANSWER.md and stop.",
          "semantic": true
        },
        {
          "dimension": "evidence",
          "id": "grounding",
          "requirement": "Bind factual claims to actual source ranges or reproducible checks; distinguish static inference from verified behavior.",
          "semantic": true
        },
        {
          "dimension": "usability",
          "id": "usability",
          "requirement": "Give actionable, internally consistent output at the detail the task requests.",
          "semantic": true
        },
        {
          "dimension": "causality",
          "id": "causal-chain",
          "requirement": "Explain or implement the causal relationship, including requested negative controls.",
          "semantic": true
        }
      ],
      "task_id": "panel-t2",
      "version": 1
    }
  },
  "oracle_id": "panel-t2",
  "schema_version": "1.0",
  "task_id": "panel-t2",
  "visibility": "public"
}
