{
  "definition": {
    "quality_rubric": {
      "criteria": [
        {
          "accepted_equivalents": "Any accurate wording supported by frozen source or protected behavior.",
          "dimension": "correctness",
          "id": "substance",
          "requirement": "index.ts exports wrapper.convert as format; wrapper calls impl.transform; consumer.display calls format; unrelated.format is a different declaration.",
          "semantic": true
        },
        {
          "dimension": "completeness",
          "id": "requested-coverage",
          "requirement": "Trace public format from its re-export through the implementation. List runtime consumers and distinguish the unrelated format. Write your answer to BENCHMARK_ANSWER.md and stop.",
          "semantic": true
        },
        {
          "dimension": "evidence",
          "id": "grounding",
          "requirement": "Bind factual claims to actual source ranges or reproducible checks; distinguish static inference from verified behavior.",
          "semantic": true
        },
        {
          "dimension": "usability",
          "id": "usability",
          "requirement": "Give actionable, internally consistent output at the detail the task requests.",
          "semantic": true
        }
      ],
      "task_id": "panel-n3",
      "version": 1
    }
  },
  "oracle_id": "panel-n3",
  "schema_version": "1.0",
  "task_id": "panel-n3",
  "visibility": "public"
}
