{
  "definition": {
    "quality_rubric": {
      "criteria": [
        {
          "accepted_equivalents": "Any accurate wording supported by frozen source or protected behavior.",
          "dimension": "correctness",
          "id": "substance",
          "requirement": "Defaults are upper/10; environment overrides defaults; command arguments override environment; current Format rejects zero.",
          "semantic": true
        },
        {
          "dimension": "completeness",
          "id": "requested-coverage",
          "requirement": "Write an operator runbook with executable startup commands. Explain default/environment/argument precedence, expected outputs and the current zero-limit failure. Write your answer to BENCHMARK_ANSWER.md and stop.",
          "semantic": true
        },
        {
          "dimension": "evidence",
          "id": "grounding",
          "requirement": "Bind factual claims to actual source ranges or reproducible checks; distinguish static inference from verified behavior.",
          "semantic": true
        },
        {
          "dimension": "usability",
          "id": "usability",
          "requirement": "Give actionable, internally consistent output at the detail the task requests.",
          "semantic": true
        }
      ],
      "task_id": "panel-u3",
      "version": 1
    }
  },
  "oracle_id": "panel-u3",
  "schema_version": "1.0",
  "task_id": "panel-u3",
  "visibility": "public"
}
