{
  "definition": {
    "quality_rubric": {
      "criteria": [
        {
          "accepted_equivalents": "Any accurate wording supported by frozen source or protected behavior.",
          "dimension": "correctness",
          "id": "substance",
          "requirement": "convert uses options.enabled || true, so false is overwritten; transform itself correctly preserves text when enabled is false.",
          "semantic": true
        },
        {
          "dimension": "completeness",
          "id": "requested-coverage",
          "requirement": "Diagnose why format(text, {enabled:false}) changes case. Trace the wrapper boundary, explain the default rule and provide a reproduction. Write your answer to BENCHMARK_ANSWER.md and stop.",
          "semantic": true
        },
        {
          "dimension": "evidence",
          "id": "grounding",
          "requirement": "Bind factual claims to actual source ranges or reproducible checks; distinguish static inference from verified behavior.",
          "semantic": true
        },
        {
          "dimension": "usability",
          "id": "usability",
          "requirement": "Give actionable, internally consistent output at the detail the task requests.",
          "semantic": true
        },
        {
          "dimension": "causality",
          "id": "causal-chain",
          "requirement": "Explain or implement the causal relationship, including requested negative controls.",
          "semantic": true
        }
      ],
      "task_id": "panel-d3",
      "version": 1
    }
  },
  "oracle_id": "panel-d3",
  "schema_version": "1.0",
  "task_id": "panel-d3",
  "visibility": "public"
}
