{
  "definition": {
    "quality_rubric": {
      "criteria": [
        {
          "accepted_equivalents": "Any accurate wording supported by frozen source or protected behavior.",
          "dimension": "correctness",
          "id": "substance",
          "requirement": "The public picomatch API returns a matcher; guides must include positive and negative matches and distinguish empty/nonempty flags.",
          "semantic": true
        },
        {
          "dimension": "completeness",
          "id": "requested-coverage",
          "requirement": "Write a concise usage guide with runnable matching/nonmatching examples, ignore callbacks and flags precedence including the empty-flags exception. State actual expected outputs. Write your answer to BENCHMARK_ANSWER.md and stop.",
          "semantic": true
        },
        {
          "dimension": "evidence",
          "id": "grounding",
          "requirement": "Bind factual claims to actual source ranges or reproducible checks; distinguish static inference from verified behavior.",
          "semantic": true
        },
        {
          "dimension": "usability",
          "id": "usability",
          "requirement": "Give actionable, internally consistent output at the detail the task requests.",
          "semantic": true
        }
      ],
      "task_id": "panel-u1",
      "version": 1
    }
  },
  "oracle_id": "panel-u1",
  "schema_version": "1.0",
  "task_id": "panel-u1",
  "visibility": "public"
}
